{
  "$schema": "https://json-schema.org/draft/2020-12/schema",
  "$id": "https://vitryne.app/schema/1/avatar.schema.json",
  "title": "Vitryne format v1: avatars/<id>/avatar.json",
  "description": "A body to drape on: its mesh (a glTF binary part, metres, Y up, facing +Z, the wearer's left = +X) and the named regions that pieces are placed around.",
  "type": "object",
  "properties": {
    "id": { "$ref": "common.schema.json#/$defs/id" },
    "name": { "$ref": "common.schema.json#/$defs/name" },
    "mesh": {
      "description": "Path of the glTF binary part (model/gltf-binary): one mesh, triangles, metres, feet at y = 0.",
      "type": "string"
    },
    "pose": {
      "description": "The rest pose of the mesh: A, T, or another label.",
      "type": "string"
    },
    "regions": {
      "description": "Body regions, keyed by a name from the region vocabulary (file-format.md): torso, head, head-over, upper-arm-left/right, arm-left/right, arm-straight-left/right, leg-left/right. Garments refer to these names, so a garment fits any avatar that has the regions it uses.",
      "type": "object",
      "propertyNames": { "pattern": "^[a-z][a-z0-9-]*$" },
      "additionalProperties": { "$ref": "#/$defs/region" }
    },
    "measurements": {
      "description": "Body measurements, mm, keyed by name (chest, waist, hips, height, ...). Optional; informational in v1.",
      "type": "object",
      "additionalProperties": { "type": "number" }
    },
    "attribution": { "$ref": "common.schema.json#/$defs/attribution" },
    "libraryRef": { "$ref": "common.schema.json#/$defs/libraryRef" },
    "extensions": { "$ref": "common.schema.json#/$defs/extensions" },
    "extras": { "$ref": "common.schema.json#/$defs/extras" }
  },
  "required": ["id", "name", "mesh", "regions"],
  "unevaluatedProperties": false,
  "$defs": {
    "region": {
      "description": "A frame to wrap pieces around. axis: a straight line through origin along axis (towards the top of the pieces). path: a centreline through points (first = origin), smooth (Catmull-Rom), continuing straight past the last point; straight along the first segment above the origin. zero: the direction of angle 0 around the axis (projected onto the plane normal to the axis).",
      "type": "object",
      "properties": {
        "type": { "enum": ["axis", "path"] },
        "origin": { "$ref": "common.schema.json#/$defs/vec3" },
        "axis": { "$ref": "common.schema.json#/$defs/vec3" },
        "points": {
          "type": "array",
          "items": { "$ref": "common.schema.json#/$defs/vec3" },
          "minItems": 2
        },
        "zero": { "$ref": "common.schema.json#/$defs/vec3" },
        "extensions": { "$ref": "common.schema.json#/$defs/extensions" },
        "extras": { "$ref": "common.schema.json#/$defs/extras" }
      },
      "required": ["type", "zero"],
      "allOf": [
        { "if": { "properties": { "type": { "const": "axis" } } }, "then": { "required": ["origin", "axis"] } },
        { "if": { "properties": { "type": { "const": "path" } } }, "then": { "required": ["points"] } }
      ],
      "unevaluatedProperties": false
    }
  }
}
